ID,TITLE,LINK,BUTTON_TEXT,TEXT,DATES,LOCATION,EVENTABLE,HTML_ID,PDF_ID
,CITRIS Research Exchange – Margaret Burnett on Inclusive Design,https://bit.ly/researchexchange2021,Register for Live Event,"<img id='img-wrapped' class='photo' src='../images/people/burnett-margaret.jpg' alt=''><b>SPEAKER</b>: Professor, School of Electrical Engineering and Computer Science, Oregon State University<br><br><b>Abstract</b>: How can technology professionals assess whether their technology supports diverse users? And if they find problems, how can they fix them? Although there are empirical processes that can be used to find “inclusivity bugs” piecemeal, what is also needed is a systematic method to assess technology’s support for diverse populations. To fill this gap, we developed GenderMag, a method for finding and fixing “gender inclusivity bugs” — gender biases in technology interfaces and workflows. We then introduced InclusiveMag, which can be used to generate systematic inclusiveness methods for other dimensions of diversity. In this talk, we explain how GenderMag works, present the latest GenderMag results, and then introduce InclusiveMag and our early experiences with it. We conclude with actionable steps for industry and university professionals.<br><br><b>Come join us in SSM 150 from 12:00 - 1:00pm for the in person event. Lunch will be provided!</b><br><br>To zoom into the research exchange, visit: <a href=https://citris-uc.org/event/citris-research-exchange-margaret-burnett target=_blank>https://citris-uc.org/event/citris-research-exchange-margaret-burnett</a>","October 6, 2021 | 12:00 - 1:00pm",S,Zoom,,
,CITRIS Research Exchange – Shijia Pan on Cyber-Physical Systems,https://bit.ly/researchexchange2021,Register,"<img id='img-wrapped' class='photo' src='../images/people/shijia-pan.jpg' alt=''><b>SPEAKER</b>: Shijia Pan, Assistant Professor, Computer Science, and Engineering, UC Merced<br><br><b>Abstract</b>: The number of everyday smart devices is projected to grow to billions in the coming decade, which enables various smart building applications. These applications, especially in-home long-term occupant monitoring, rely on emerging device-free human sensing techniques. From the system perspective, we introduce an alternative non-intrusive sensing modality through ambient structural vibration to indirectly infer fine-grained occupant information. However, due to the complexity of the physical world, sensing data distributions face severe domain variances. Therefore, from the data perspective, accurate information learning through pure data-driven approaches requires a large amount of labeled data, which is costly and difficult to obtain in practice. We address these challenges by combining physical and data-driven knowledge in learning.<br><br> Come join us in SSM 150 from 12:00 - 1:00pm. To zoom into the research exchange, visit: <a href=https://citris-uc.org/event/citris-research-exchange-shijia-pan target=_blank>https://citris-uc.org/event/citris-research-exchange-shijia-pan</a><br><br>Add this event to your calendar: <a href=https://evt.mx/hOlMPgiO target=_blank>https://evt.mx/hOlMPgiO</a>","September 22, 2021 | 12:00 - 1:00pm",S,Zoom,,
AgBag-EliaScudiero,CITRIS Research on Ag-Food-Tech: Hybrid AGBag with Elia Scudiero,https://bit.ly/3kNtelg,Register for Zoom,"CITRIS, IoT4Ag, and LACA are delighted to host our UC Riverside colleague Dr. Elia Scudiero, Associate Research Agronomist with expertise in digital agronomy, remote sensing of soil salinity, soil-plant processes, and sustainable agriculture and water management practices. He leads the large USDA NIFA Sustainable Agricultural Systems project, “Artificial Intelligence for Sustainble Water, Nutrient, Salinity, and Pest Management in the Western US.” With UCR computer science professor Ahmed Eldawy, Scudiero is also the lead of a USDA NIFA New Investigator Award for a project helping California farmers use water more efficiently while protecting crops.",15-Sep-21,15-Sep-21,,,
,CITRIS Research on Ag-Food-Tech Ag Bag with Curran Hughes,https://ucmerced.zoom.us/meeting/register/tZYrfuyppj0tGdJ6vqHVNKsmqG7RepNsrQOD,Register for Zoom,"Join CITRIS UCMERCED on Wednesday, September 1st from 12:00pm-1:00pm in <b>SE2 224</b> and <a href=https://ucmerced.zoom.us/meeting/register/tZYrfuyppj0tGdJ6vqHVNKsmqG7RepNsrQOD target=_blank>Zoom</a> as we host Curran Hughes, a UC Davis graduate who is bringing his new technology for controlled environments and low-cost growing spaces to UC Merced. Curran has a company with the vision to eliminate agricultural plastic waste. The company deploys lightweight and recyclable industrial fabrics that can supplant most agricultural plastic films as well as toxic PVC fabrics in industrial and structural settings. Unlike incumbent agricultural plastic film manufacturers that push environmental costs on to growers and consumers, this new venture partners with growers to guarantee that materials are recycled at the end of their useful life, ultimately building a circular economy for agricultural and industrial plastics.","September 1st, 2021","September 1st, 2021",,,
,"The American Academy of Environmental Engineers and Scientists (AAEES) Distinguished Kappe Lecture on Transprofessional Environmental Wellness: GRoWES- Global Research on WaSH (Water, sanitation and hygiene) to Eliminate childhood stunting",http://bit.ly/2021KappeUCM,,"UNICEF estimates that one quarter of all children less than five years of age are stunted, globally. Stunting is closely linked to inadequate nutrition during the first 1,000-days of a child’s life, which is defined as the time from when a mother learns she is pregnant until the second birthday of her child. <br><br>Global Research on WaSH (water, sanitation and hygiene) to Eliminate childhood Stunting – aims to achieve four goals, namely: <br>1. Improving our basic understanding of the relationship between stunting and WaSH; <br>2. Eliminating stunting at pilot sites through targeted interventions; <br>3. Replicating and scaling-up sustainable solutions to stunting; and <br>4. Influencing global policy on nutrition (i.e., through the United Nations Decade of Action on Nutrition 2016-2025). <br><br> Join <a href=https://www.aaees.org/_downloadcenter/kappe/KappeBrochure-2020.pdf target='_blank'>Professor Daniel B. Oerther</a> on Friday, April 9th, from 12-1:30pm via zoom for this AAEES Kappe Lecture.",April 9th,Zoom,,,
ccyouth,Converging COVID 19 : Youth Moving Forward Virtual Conference,https://aeespconvergingcovid19.org/converging-covid-19-youth-moving-forward/,http://bit.ly/YouthForwardCOVID19,"A follow-up to the AEESP Converging COVID-19: Environment, Health, and Equity conference series. We want to allow the younger generation of adults (high school, undergraduate, graduate, and early career) to come together and discuss issues relevant to youth and COVID-19. The Conference will begin with a brief introduction with experts then student facilitated break-out rooms on Education, Youth Health, Vaccination, and Environment.  <br><br> Please Join us on April 8th from 10:30am - 12pm via zoom. Register below.","April 8th, 2021",zoom,,,
,2021 AG Tech Summit: Adapt + Thrive,https://valleyagtech.org/schedule,NO_BUTTON,"The 3rd Annual Ag Tech Summit focusing on advancing Ag Technology in the Central Valley will take a look at industry insights into key technologies in ag along with information and resources to deal with the COVID pandemic. <br><br> The event will take place from 8:30 am - 11:45 am on March 23rd, 2021, and from 8:30 am - 10:30 am on March 24th, 2021.","March 24th, 2021",,,,
2021women-in-tech-symposium,Registration is now open for the 2021 Women in Tech Symposium,https://www.eventbrite.com/e/women-in-tech-symposium-the-new-era-in-human-computer-interaction-tickets-120444415489,,"Registration for the Women in Tech Initiative at UC’s flagship event is now open! Now in its fifth year, this major annual event will showcase issues, sector opportunities, and the career paths of experts in human-computer interaction (HCI). <br>Now entering a new era, human-computer interaction is a multidisciplinary field that combines new technology in cyber-physical systems with human-centered design and usability. This year’s symposium will examine leading-edge technologies and challenges to ensuring equitable and inclusive HCI. <br><br>The event will take place on March 12, 2021!",20210312/20210312,12-Mar-21,,,
,HackMerced VI registration open,https://hackmerced.com/#hackmercedvi,,Sign up for the biggest hackathon in the San Joaquin Valley and show off your coding skills at this 36 hours event taking place from March 12-14.,20210210/20210210,,,,
,CITRIS Foundry Startup Showcase - Spring 2021,https://berkeley.zoom.us/meeting/register/tJEpcuGtpjouE9RCC7DZIJ_pwpdvfUOnlC_w?mc_cid=ae0492ad70&mc_eid=UNIQID,NO_BUTTON,"CITRIS Foundry would like to invite our alumni, mentors, advisors, and supporters, as well as the broader CITRIS and UC Berkeley community to join us in celebrating our Spring and Summer Cohort Startups from 2020. At CITRIS Foundry our innovators tackle big problems in industries ranging from cleantech to medical devices to consumer products and AI. By leveraging the incredible resources and expertise at UC Berkeley and the Bay Area entrepreneurship community, we help bring emerging innovation to market and society! <br><br>Join us on March 4th, 2021 at 4:30 pm via Zoom.",,,Zoom,,
,CITRIS Research Exchange with Sam Markolf,https://citris-uc.us2.list-manage.com/track/click?u=78285230b179f5fc2a6bcbbb3&id=aca5c036f5&e=2a237c259b,NO_BUTTON,"Dr. Samuel Markolf is an Assistant Professor within the Department of Civil and Environmental Engineering at the University of California-Merced, where his research broadly focuses on applying systems-thinking to sustainability and resilience challenges facing cities and infrastructure systems.<br><br>Join Sam Markolf on Wednesday March 3, 2021 from 12:00 pm to 1:00 pm via Zoom!",20210303/20210303,3-Mar-21,Zoom,,
,"The Charisma Machine: The Life, Death, and Legacy of One Laptop per Child with Morgan Ames",https://citris-uc.us2.list-manage.com/track/click?u=78285230b179f5fc2a6bcbbb3&id=4c4d29be65&e=2a237c259b,NO_BUTTON,"Ames will discuss her book The Charisma Machine, named Best Information Science Book of 2020, to explore the life and legacy of the One Laptop per Child project and explain why—despite its failures—the same utopian visions that inspired OLPC still motivate other projects trying to use technology to “disrupt.” Announced in 2005 by MIT Media Lab cofounder Nicholas Negroponte, One Laptop per Child promised to transform the lives of children across the Global South. Even as the project fell short in many ways, it remained charismatic to many who were enchanted by its claims of a global transformation. Drawing on archival research and an ethnographic study of a model OLPC project, Ames offers a cautionary tale about the allure of technology hype and the problems that result when utopian dreams drive technology development.<br><br>Join Morgan Ames on Wednesday February 24, 2021 from 12:00 pm to 1:00 pm via Zoom!",20210224/20210224,24-Feb-21,Zoom,,
,"Labor and Automation in California Agriculture: Equity, Productivity, & Resilience with Tom Harmon",https://citris-uc.us2.list-manage.com/track/click?u=78285230b179f5fc2a6bcbbb3&id=57549493c4&e=2a237c259b,NO_BUTTON,"An agricultural revolution driven by automation, big data, and artificial intelligence is upon us. This presentation will introduce an exciting new research effort being undertaken by an interdisciplinary team from the University of California Merced, Berkeley, Davis, and Riverside campuses and UC Agriculture and Natural Resources. California is an agriculturally rich state, yet its food system remains vulnerable to climate change, regulatory change, water availability, labor shortages, and unexpected disturbances. We know that automation improves efficiency. However, to create a sustainable California agri-food system, we must create a new model for agricultural technology (AgTech) design. This new design paradigm support more and better food while creating a vibrant future for workers and a healthy environment for future generations. <br><br>Join Thomas Harmon on Wednesday February 17, 2021 from 12:00 pm to 1:00 pm via Zoom!",20210217/20210217,17-Feb-21,Zoom,,
,CITRIS Research Exchange with Sara-Jayne Terp,https://citris-uc.us2.list-manage.com/track/click?u=78r285230b179f5fc2a6bcbbb3&id=f59cccab22&e=2a237c259b,NO_BUTTON,"Sara-Jayne Terp is a data enthusiast with a long history of working on the hardest data problems she can find. Her background includes designing unmanned vehicle systems, transport, intelligence and disaster data systems with an emphasis on how humans and autonomous systems work together; developing crowdsourced advocacy tools, managing innovations, teaching data science to Columbia’s international development students, designing probabilistic network algorithms, working as a pyrotechnician, and CTO of the UN’s big data team. <br><br> Join Sara-Jayne Terp on Wednesday February 10, 2021 from 12:00 pm to 1:00 pm via Zoom!",20210210/20210210,10-Feb-21,Zoom,,
,CITRIS Research Exchange with Cristina Davis,https://citris-uc.us2.list-manage.com/track/click?u=78285230b179f5fc2a6bcbbb3&id=1bdb95af30&e=2a237c259b,NO_BUTTON,"Professor Davis works at the interface of mechanical design, data analytics and chemistry. She designs and implements cutting-edge chemical sensor systems to solve real-world problems and enable trace chemical detection in challenging environments. Her research group is diverse and interdisciplinary in composition and in research. Researchers from engineering, chemistry and computer science have a wide array of activity that ranges from novel sensor development to systems integration, to basic chemistry studies to discover novel biomarkers of significance. Her research has broad applications in human and animal health monitoring, as well as in agriculture. Her award-winning work has impacted many user communities, and she has spun off two UC Davis-affiliated startup companies from her research to commercialize the work.<br><br>Join Cristina Davis on Wednesday February 3, 2021 from 12:00 pm to 1:00 pm via Zoom!",20210203/20210203,3-Feb-21,Zoom,,
ucanrwaterwebinar,UC ANR Water Webinar,pdfs\UCANRWATERWEBINAR.pdf,NO_BUTTON,Join Dr. Colleen C. Naughton on January 15th from 3-4 pm as she describes how nitrate contamination of groundwater in California relates to thyroid cancer incidence in the Central Valley. These maps and analysis will help inform the public and policy leaders of the types of health-related concerns in relation to water pollution in California and where to target interventions.,20210115/20210115,15-Jan-21,https://ucmerced.zoom.us/j/93722796133?pwd=a2FsKzBTUGVtOEovSTNVanRSNjZMdz09;,,
,The Alignment Problem: Machine Learning and Human Values with Brian Christian,https://citris-uc.us2.list-manage.com/track/click?u=78285230b179f5fc2a6bcbbb3&id=af4c9bb2f7&e=2a237c259b,NO_BUTTON,"With the incredible growth of machine learning over recent years has come an increasing concern about whether ML systems' objectives truly capture their human designers' intent: the so-called 'alignment problem.' Over the last five years, these questions of both ethics and safety have moved from the margins of the field to become arguably its most central concerns. <br><br>Join Brian Christian on Wednesday January 27, 2021 from 12:00 pm to 1:00 pm via Zoom!",20210127/20210127,27-Jan-21,Zoom,,
,"COVID-19 and climate change mitigation, and adaptation",https://aeespconvergingcovid19.org/,https://www.youtube.com/channel/UCmlGaQ6wmFZbbrvdG4hZ2BA/videos,"The goal of this virtual conference, “Converging COVID-19, environment, health, and equity,” is to bring together different disciplines of environmental engineering and science (water, wastewater, air, food, waste, built environment) plus equity and climate change to discuss actions needed to form &quot;a healthy, just and equitable society.&quot;  <br><br>This conference will be held from 12:00-1:30 pm ET on November 20th, 2020. It will combine asynchronous ~3 minute videos produced on each speaker’s research, and shared on the <a href=https://www.youtube.com/channel/UCmlGaQ6wmFZbbrvdG4hZ2BA/videos>Association of Environmental Engineering and Science Professors’ (AEESP) YouTube Channel</a>, and a professionally hosted synchronous 90 minute moderated, interactive webinar that is streamed live via YouTube.",20201120/20201120,20-Nov-20,https://www.youtube.com/channel/UCmlGaQ6wmFZbbrvdG4hZ2BA/videos,,
,UC ANR Water Webinar,https://ucmerced.zoom.us/j/93722796133?pwd=a2FsKzBTUGVtOEovSTNVanRSNjZMdz09,NO_BUTTON,"Dr. Angel Santiago Fernandez Bou will present SGMA related work titled 'A Glass Half Empty & Underrepresented, underserved, understudied' in the Monthly Water PT Webinar Series on Friday 11/20 at 3pm. <br> Join the Webinar on <a href=https://ucmerced.zoom.us/j/93722796133?pwd=a2FsKzBTUGVtOEovSTNVanRSNjZMdz09>zoom</a> <br> Passcode: 92837",20201120/20201120,20-Nov-20,https://ucmerced.zoom.us/j/93722796133?pwd=a2FsKzBTUGVtOEovSTNVanRSNjZMdz09,,
,CITRIS COVID-19 Response Seed Award Outcomes Panel,https://berkeley.zoom.us/webinar/register/WN_jzOTOTk-RjqLGWnJD92dbw?utm_source=CITRIS+Announcements&utm_campaign=3e85b24b38-CITRIS_Research_Exchange_Fall_2020&utm_medium=email&utm_term=0_92ad2a0544-3e85b24b38-332138289&mc_cid=3e85b24b38&mc_eid=2a237c259b,NO_BUTTON,"Speakers: Coming Soon<br/><br/>Join us Wednesday November 18, 2020 from 12:00 pm to 1:00 pm via Zoom!",20201118/20201118,18-Nov-20,Zoom,,
,COVID-19 and fostering informed decisions and actions,https://aeespconvergingcovid19.org/,https://www.youtube.com/channel/UCmlGaQ6wmFZbbrvdG4hZ2BA/videos,"The goal of this virtual conference, “Converging COVID-19, environment, health, and equity,” is to bring together different disciplines of environmental engineering and science (water, wastewater, air, food, waste, built environment) plus equity and climate change to discuss actions needed to form &quot;a healthy, just and equitable society.&quot;  <br><br>This conference will be held from 12:00-1:30 pm ET on October 23rd, 2020. It will combine asynchronous ~3 minute videos produced on each speaker’s research, and shared on the <a href=https://www.youtube.com/channel/UCmlGaQ6wmFZbbrvdG4hZ2BA/videos>Association of Environmental Engineering and Science Professors’ (AEESP) YouTube Channel</a>, and a professionally hosted synchronous 90 minute moderated, interactive webinar that is streamed live via YouTube.",20201023/20201023,23-Oct-20,https://www.youtube.com/channel/UCmlGaQ6wmFZbbrvdG4hZ2BA/videos,,
,COVID-19 and designing a future without pollution and waste,https://aeespconvergingcovid19.org/,https://www.youtube.com/channel/UCmlGaQ6wmFZbbrvdG4hZ2BA/videos,"The goal of this virtual conference, “Converging COVID-19, environment, health, and equity,” is to bring together different disciplines of environmental engineering and science (water, wastewater, air, food, waste, built environment) plus equity and climate change to discuss actions needed to form &quot;a healthy, just and equitable society.&quot;  <br><br>This conference will be held from 12:00-1:30 pm ET on November 13th, 2020. It will combine asynchronous ~3 minute videos produced on each speaker’s research, and shared on the <a href=https://www.youtube.com/channel/UCmlGaQ6wmFZbbrvdG4hZ2BA/videos>Association of Environmental Engineering and Science Professors’ (AEESP) YouTube Channel</a>, and a professionally hosted synchronous 90 minute moderated, interactive webinar that is streamed live via YouTube.",20201113/20201113,13-Nov-20,https://www.youtube.com/channel/UCmlGaQ6wmFZbbrvdG4hZ2BA/videos,,
,Blockchain for the Public Good,https://berkeley.zoom.us/webinar/register/WN_TxnKMK87T-SyFdjmNqsguw?utm_source=CITRIS+Announcements&utm_campaign=3e85b24b38-CITRIS_Research_Exchange_Fall_2020&utm_medium=email&utm_term=0_92ad2a0544-3e85b24b38-332138289&mc_cid=3e85b24b38&mc_eid=2a237c259b,NO_BUTTON,"Speakers: Brian Behlendorf (Executive Director, Hyperledger), Ben Bartlett (Partner, Tackett Bartlett LLP), and Michele Benedetto Neitz (Professor of Law, Golden Gate University School of Law). Moderated by Camille Crittenden, Ph.D., Executive Director of CITRIS and the Banatao Institute.<br/><br/>This talk will draw on the panelists' expertise in the fundamental computer science and security concerns of blockchain, its applications for public finance, and ethical considerations of its development. We will also discuss the experience of working with a broad group of stakeholders to create a roadmap for policymakers, CIOs and other leaders considering blockchain solutions for public sector applications.<br/><br/>Join us Wednesday October 28, 2020 from 12:00 pm to 1:00 pm via Zoom!",20201028/20201028,28-Oct-20,Zoom,,
,"COVID-19 and the creation of efficient, healthy and resilient cities",https://aeespconvergingcovid19.org/,https://www.youtube.com/channel/UCmlGaQ6wmFZbbrvdG4hZ2BA/videos,"The goal of this virtual conference, “Converging COVID-19, environment, health, and equity,” is to bring together different disciplines of environmental engineering and science (water, wastewater, air, food, waste, built environment) plus equity and climate change to discuss actions needed to form &quot;a healthy, just and equitable society.&quot;  <br><br>This conference will be held from 12:00-1:30 pm ET on October 30th, 2020. It will combine asynchronous ~3 minute videos produced on each speaker’s research, and shared on the <a href=https://www.youtube.com/channel/UCmlGaQ6wmFZbbrvdG4hZ2BA/videos>Association of Environmental Engineering and Science Professors’ (AEESP) YouTube Channel</a>, and a professionally hosted synchronous 90 minute moderated, interactive webinar that is streamed live via YouTube.",20201030/20201030,30-Oct-20,https://www.youtube.com/channel/UCmlGaQ6wmFZbbrvdG4hZ2BA/videos,,
,Scientific Natural Language Processing and the Fight Against COVID-19,https://berkeley.zoom.us/webinar/register/WN_-isL05ShS9m8anjpHwzFTQ?utm_source=CITRIS+Announcements&utm_campaign=3e85b24b38-CITRIS_Research_Exchange_Fall_2020&utm_medium=email&utm_term=0_92ad2a0544-3e85b24b38-332138289&mc_cid=3e85b24b38&mc_eid=2a237c259b,NO_BUTTON,"Speaker: Oren Etizioni, Chief Executive Officer, Allen Institute for AI<br/><br/>This talk will describe the dramatic creation of the COVID-19 Open Research Dataset (CORD-19) and the broad range of efforts, both inside and outside of the Semantic Scholar project, to garner insights into COVID-19 and its treatment based on this growing corpus of research papers.<br/><br/>Join us Wednesday November 4, 2020 from 12:00 pm to 1:00 pm via Zoom!",20201104/20201104,4-Nov-20,Zoom,,
,"COVID-19 and sustainably supplying food, water, and energy COVID-19",https://aeespconvergingcovid19.org/,https://www.youtube.com/channel/UCmlGaQ6wmFZbbrvdG4hZ2BA/videos,"The goal of this virtual conference, “Converging COVID-19, environment, health, and equity,” is to bring together different disciplines of environmental engineering and science (water, wastewater, air, food, waste, built environment) plus equity and climate change to discuss actions needed to form &quot;a healthy, just and equitable society.&quot;  <br><br>This conference will be held from 12:00-1:30 pm ET on November 6th, 2020. It will combine asynchronous ~3 minute videos produced on each speaker’s research, and shared on the <a href=https://www.youtube.com/channel/UCmlGaQ6wmFZbbrvdG4hZ2BA/videos>Association of Environmental Engineering and Science Professors’ (AEESP) YouTube Channel</a>, and a professionally hosted synchronous 90 minute moderated, interactive webinar that is streamed live via YouTube.",20201106/20201106,6-Nov-20,https://www.youtube.com/channel/UCmlGaQ6wmFZbbrvdG4hZ2BA/videos,,
,CITRIS Research Exchange with Gabe Youtsey,https://citris-uc.us2.list-manage.com/track/click?u=78285230b179f5fc2a6bcbbb3&id=7690d1cc5b&e=2a237c259b,NO_BUTTON,"SPEAKER: Gabe Youtsey, Chief Innovation Officer, UC Agriculture, and Natural Resources<br/><br/>Join us Wednesday October 21, 2020 from 12:00 pm to 1:00 pm via Zoom!",20201021/20201021,21-Oct-20,Zoom,,
convergingcovid1,"COVID-19, systemic biases, and environmental engineering education",https://aeespconvergingcovid19.org/,https://www.youtube.com/channel/UCmlGaQ6wmFZbbrvdG4hZ2BA/videos,"The goal of this virtual conference, “Converging COVID-19, environment, health, and equity,” is to bring together different disciplines of environmental engineering and science (water, wastewater, air, food, waste, built environment) plus equity and climate change to discuss actions needed to form &quot;a healthy, just and equitable society.&quot;  <br><br>This conference will be held from 12:00-1:30 pm ET on October 16th, 2020. It will combine asynchronous ~3 minute videos produced on each speaker’s research, and shared on the <a href=https://www.youtube.com/channel/UCmlGaQ6wmFZbbrvdG4hZ2BA/videos>Association of Environmental Engineering and Science Professors’ (AEESP) YouTube Channel</a>, and a professionally hosted synchronous 90 minute moderated, interactive webinar that is streamed live via YouTube.",20201016/20201016,16-Oct-20,https://www.youtube.com/channel/UCmlGaQ6wmFZbbrvdG4hZ2BA/videos,,
