ID,TITLE,LINK,BUTTON_TEXT,TEXT,DATES,LOCATION,EVENTABLE,HTML_ID,PDF_ID
AgAID-Digital-Agathon-flyer,AgAID Digital Agathon,https://citris.ucmerced.edu/agaid-digital-agathon,Learn More,The AgAID Institute’s mission is to build and foster partnerships between AI and Ag communities and create a transdisciplinary ecosystem for technology innovation and knowledge transfer.<ul class='default'><li>Work in teams of 4-6</li><li>Win Cash Prizes</li><li>Add a project to your resume</li><li>Participate in workshops with free food</li><li>Minimal programming experience needed</li></ul>,"January 27-29, 2023",,,,
wip-banner,CITRIS Workforce Innovation Program,https://citris-uc.org/labs-programs/citris-workforce-innovation/,Learn More and Apply,"The CITRIS Workforce Innovation Program helps UC students pursue world-changing research and accelerate their careers.<br>Applications are due Monday, Jan. 30<br>The program offers select University of California students the opportunity to inform their career decisions through eight-week paid internships, where they'll build in-demand skills through on-the-job experience. Participants will receive training in leadership and project management, and will be supported throughout the internship program by dedicated CITRIS staff, as well as the community of peers in their cohort.<br>CITRIS and the Banatao Institute invite undergraduates from all majors at UC Berkeley, UC Davis, UC Merced and UC Santa Cruz to apply for placements in one of five areas of emerging IT innovation important to the state of California: aviation, climate and energy, digital health, robotics, and semiconductors.<br>Students who represent the rich diversity of the University of California, including women, people from underrepresented backgrounds, Pell Grant recipients, undocumented students and first-generation students, are encouraged to apply.<br><b>Internship duration: 8 weeks</b><br>May-August 2023 (UC Berkeley and UC Merced students)",30-Jan-23,,,,
,CITRIS Foundry,https://citrisfoundry.org/,Learn More and Apply,"<b>Apply to the CITRIS Foundry spring 2023 cohort<br><br>Applications due Tuesday, Jan. 31, at 11:59 p.m. PST<br><br>The CITRIS Foundry is the University of California's deep tech incubator. We support top UC entrepreneurs in their journeys to turn information technology innovations into startups that will transform the world.<br><br>Located at the headquarters of the <a href='https://citris-uc.org' target='_blank'>Center for Information Technology Research in the Interest of Society and the Banatao Institute</a> (CITRIS) on the UC Berkeley campus, the CITRIS Foundry serves <a href='https://citris-uc.org/about/campuses/' target='_blank'>four UC campuses</a> by providing teams with resources and facilities to help bridge the gap from lab to market. Since its founding in 2013, the program has supported more than 126 teams that have raised over $220M in follow-on funding. <br><br>We invite you to apply to our 12-month program, which starts in spring 2023. <br><br><a href='https://citrisfoundry.org/program' target='_blank'>Apply by Jan. 31</a><br><br>Please visit the <a href='https://citrisfoundry.org' target='_blank'>CITRIS Foundry website</a> for a complete overview of the program scope, eligibility requirements and application guidelines. <br><br>Read about the program's refreshed vision in the <a href='https://citris-uc.org/citris-foundry-introduces-new-vision-under-managing-director-marc-theeuwes/' target='_blank'>Q&A with Marc Theeuwes</a>, the CITRIS Foundry's new managing director. <br><br>If you have any questions, please contact:<br><a href='mailto:thefoundry@citris-uc.org'>thefoundry@citris-uc.org</a></b>",31-Jan-23,,,,
tech-symposium,Smarter Tech for a Resilient Future,https://citris-uc.us2.list-manage.com/track/click?u=78285230b179f5fc2a6bcbbb3&id=833d66ff67&e=9540515cc2,Register Here,"2023 EDGE in Tech Symposium:
Smarter Tech for a Resilient Future<br><br>Thursday, March 2, 2023<br>9 a.m.-5 p.m. PT<br><br>How can we engage diverse talent to transform the future of infrastructure to address inequality and promote smarter environments?<br>Join EDGE in Tech, CITRIS and the Banatao Institute, and Berkeley Engineering on Thursday, March 2, 2023, for Smarter Tech for a Resilient Future, a virtual symposium highlighting the experiences of experts using emerging technologies to advance innovation for more sustainable infrastructure.<br><br>The event will feature professionals who are pioneering new approaches to intelligent transportation networks, healthy indoor environments, aviation infrastructure and next-generation agriculture. Speakers will also discuss their career pathways to help attendees visualize themselves in high-growth sectors and rise to meet society's needs for a greener future.<br>The symposium will also feature the EDGE in Tech Athena Awards, recognizing leaders who have championed the advancement of women and people of color in technology.",2-Mar-23,,,,
OLD,,,,,,,,,
CITRIS-TensorFlow-for-Social-Good,TensorFlow for Social Good,https://citris.ucmerced.edu/tsg,Learn More,"The CITRIS TensorFlow for Social Good program, funded by Google Research, is designed to give undergraduate students a start in TensorFlow, Machine Learning; build camaraderie and teamwork, and add a project to their resumes while developing something of use to society.<ul class='default'><li>Learn to use Tensorflow, an industry-grade machine learning technology</li><li>Work with teams of 2-4</li><li>Win prizes up to $1000</li><li>Add a project to your resume</li><li>Learn skills wanted in the industry</li><li>Participate in workshops with free food</li></ul>",Trainings Occur September 9 - Early December,,,,
West-Regional-Interview-Event,Lockheed Martin West Regional Virtual Hiring Event/Interview Day,https://sjobs.brassring.com/TGnewUI/Search/home/HomeWithPreLoad?partnerid=25037&siteid=5123&PageType=JobDetails&jobid=702461#jobDetails=702461_5123,Engineering Opportunities,"We are looking for the best and brightest to help us fulfill our mission of keeping the world secure by seeking students looking for Full-Time or Internship positions and majoring in Computer Science, Cyber Security, Information Technology or related discipline to fill Software Engineering positions and those majoring in Aerospace, Computer, Electrical, Industrial, Manufacturing, Mechanical or related disciplines to fill a variety of Engineering positions.<center><a class='button' href='https://sjobs.brassring.com/TGnewUI/Search/home/HomeWithPreLoad?partnerid=25037&siteid=5123&PageType=JobDetails&jobid=702458#jobDetails=702458_5123' target='_blank'>Software Opportunities</a></center>","Apply by November 9th, Interview day is November 15th",,,,
modeling-your-poster,Modeling Your Future,https://forms.gle/SsVFDMp6SxA8GYio8,Register Here,"Happening at UC Merced on Saturday, November 5th, 8:30 AM - 7:30 PM. <br><br>A workshop series inaugural event to learn about technology, Computer Science, networking and research. <ul class='default'><li>This is a free conference, open to Central Valley students.</li><li>Discover paid research opportunities and apply at this event.</li></ul>",November 5th 8:30 AM - 7:30 PM.,,,,
luca-camignani-event,Effects of wind and geometry on the smoldering of woody fuels,,NO_BUTTON,"Mechanical Engineering Seminar is hosting Luca Carmignani who is a new Fire Advisor at UC ANR. <br><br> Join Luca's Seminar about effects of wind and geometry on the smoldering of woody fuels on Friday, October 28th , 10:30 AM ",October 28th at 10:30 AM,,,,
BSA Overview Flyer 2022_Updated,Bobcat Summer STEM Academy (6th – 12th Grade),https://commerce.cashnet.com/cashneti/static/storefront/UCME251_W1/catalog,Register Here,"Bobcat Summer STEM Academy is a series of weekly workshops for middle and high school students at the UC Merced campus. BSA workshops are created by UC Merced faculty, postdocs, research scientists, students, and staff. Workshops are designed to give students one of a kind, hands-on STEM experiences. Bobcat Summer STEM Academy runs from June 6th, 2022 – July 29th, 2022. Workshops are in-person, Monday – Friday, from 9am – 4pm. Lunch and snacks are provided. Spots are limited to 24 students per workshop.",June 6th – July 29th ,,,teacher-summer-institute,
Crestlogo+final,CEST STEM Camp and Virtual Sessions (K-12th Students & Teachers),https://ucmerced.az1.qualtrics.com/jfe/form/SV_b1SnBLvImTOLKh8,Register Here,"Open to K-12 students & teachers.The sessions will feature post-docs, graduate students,research scientists, faculty, and staff at UC Merced.Topics range from STEM activities to the innovative research findings","July 25-29, 2022","University of California, Merced",,cest-stem-camp,
Summer Institute CS for All,Teacher Summer Institute (K-12 Teachers),https://calteach.ucmerced.edu/SummerTeacherInstitute2022,Learn More,"Professional development in STEM fields.Led by staff, faculty, guest speakers, and more!Hosted by CalTeach UC Merced and CCBM",June 21st-June 24th,UC Merced campus (lunch provided!) remote options available,,summer-institute-cs-for-all,
KiDS Discovery STEM Camp21,"Elementary STEM Academy (1st, 2nd, and 3rd Grade)",https://www.kidsdiscoverystation.org/programs,Learn More,"Partnership with KiDS Discovery Station.Open to students who have finished grades 1st, 2nd, and/or 3rd",June 6th-10th,UC Merced ,,,
loh-flyer2,The motivation for chiplets and their Adoption in AMD Processors with Dr. Loh,NO_BUTTON,NO_BUTTON,"For decades, Moore’s Law has delivered the ability to integrate an exponentially increasing number of devices in the same silicon area at a roughly constant cost. This has enabled tremendous levels of integration, where the capabilities of computer systems that previously occupied entire rooms can now fit on a single integrated circuit. In recent times, the steady drum beat of Moore’s Law has started to slow down. Whereas device density historically doubled every 18-24 months, the rate of recent silicon process advancements has declined. While improvements in device scaling continue, albeit at a reduced pace, the industry is simultaneously observing increases in manufacturing costs. In response, the industry is now seeing a trend toward reversing direction on the traditional march toward more integration. Instead, multiple industry and academic groups are advocating that systems on chips (SoCs) be “disintegrated” into multiple smaller “chiplets.” This talk provides an overview of the technology challenges that motivated AMD to use chiplets, the technical solutions we developed for our products, and how we expanded the use of chiplets from individual processors to multiple product families. <br><br>Bio: Gabe is a Senior Fellow in AMD Research. He received his Ph.D. and M.S. in computer science from Yale University in 2002 and 1999, respectively, and his B.Eng. in electrical engineering from the Cooper Union in 1998. Gabe was also a tenured associate professor in the College of Computing at the Georgia Institute of Technology, a visiting researcher at Microsoft Research, and a senior researcher at Intel Corporation. He is a Fellow of the ACM and IEEE, recipient of ACM SIGARCH's Maurice Wilkes Award, Hall of Fame member for the MICRO, ISCA, and HPCA conferences, (co-)inventor on over ninety granted US patents, and a recipient of a U.S. National Science Foundation CAREER Award.","Friday, April 29, 2022 | 12-1PM",UC Merced SSB 170,,,CITRIS_FIT_LOH
amy-wu-event,AUTHOR EVENT WITH AMY WU HIGHLIGHTS WOMEN IN AGRIFOODTECH,https://snri.ucmerced.edu/sites/snri.ucmerced.edu/files/documents/amywu_flyer.pdf,View Full Flyer,"“We need more women at the table and it begins with giving voice to the journey of women who are already contributing to the food systems.” In person event at UC Merced with Amy Wu, creator of “From Farms to Incubators,” the book, the multimedia platform, the movement: connecting and empowering women in agrifoodtech and amplifying their voices, contributions, and innovations. <b>Free book to first 25 attendees</b>; undergraduate and graduate students in ag and STEM are particularly encouraged to attend. Light refreshments provided. This is a <a href=https://sustainability.ucmerced.edu/initiatives/food/no-food-left-behind target=_blank>No Food Left Behind</a> event. <br><br> <b>About the Author: </b><br>Amy Wu is the Creator and Chief Content Director of From Farms To Incubators. In 2020 Amy was named on Worth magazine's 'Groundbreakers 2020 list of 50 Women Changing the World' list. She was also a recipient of the Women in Agribusiness Demeter Award of Excellence. <br><br>Prior to starting From Farms to Incubators, Amy spent over two decades as an investigative reporter at media outlets including the USA Today Network where she reported on agriculture and agtech for The Salinas Californian. <br><br><b>Location: UC Merced Campus Conference Center Room 110 || April 12, 4:00 - 5:30</b>","Tuesday April 12, 2022| 4:00 - 5:30pm",,,,
o2fund,Oxygen Fund Info Session,https://events.ucmerced.edu/event/oxygen_fund_info_session,Learn More,"Join this info session to learn more about applying to the Oxygen Fund. The Oxygen Fund was established to help bring your idea, invention, business, class project, capstone, venture, or hackathon idea to the next step. The award is meant to give you oxygen, or breathing room, to spend time pursuing and developing your project. <br><br> <b>Zoom ID: 209 382 4142</b>","Friday, April 8, 2022 | 12pm to 12:30pm",,,,
agbag-david-z-2-7-2022,CITRIS Research on Ag-Food-Tech: Hybrid AGBag with DR. DAVID ZILBERMAN,https://ucmerced.zoom.us/meeting/register/tZMpfu-rpzgiHtUzycIj87mdKgGpDjSiAQqg,Register to Attend via zoom,"Zilberman is a highly cited thought leader in water policy and environmental and resource policy in agriculture. His work spans international issues in health and animal agriculture and tech adoption in Californian irrigation systems. He writes for a variety of audiences through Extension, general public and scholarly publications.<br><br><b>Join Dr. David Zilberman on Monday, March 14th at 12pm via zoom with the button below.</b>",14-Mar-22,,,,
,Tri-valley Innovation fair 2022,https://quest-science.org/innovation-fair/,Register,"The Tri-valley Innovation Fair connects everyone to the excitement of science, engineering, and technology. 55 exhibitors will showcase the region’s rich and diverse accomplishments, and learning opportunities. Meet the people who make innovation happen in local companies, schools, and community organizations. Interactive and hands-on activities will be featured indoors and outside. Special performances are also scheduled throughout the day. Activities span a range of topics, including rockets, robots, agriculture, weather, chemistry, health, biotech, art, astronomy, music, animals, and more!  The event program and final list of activities will be posted <a href=https://quest-science.org/innovation-fair/ target=_blank>here</a> a week before the event.","March 19, 2022 | 10am - 5 pm",,,,
murali,EECS and CITRIS Frontiers in Technology presents Dr. Murali Annavaram,https://ucmerced.zoom.us/meeting/register/tZArdOiqpzoqG9aS1F8weaEnoV2ginJiqPtX?utm_source=CITRIS&utm_medium=poster&utm_campaign=FIT,Register to Attend via Zoom,"Please join us for a special lecture hosted jointly by the Electrical Engineering and Computer Science Graduate Group and CITRIS UC Merced. This talk will cover privacy and security-related concerns as machine learning growth reaches diverse application domains. The data holders want to train or infer with private data while exploiting accelerators, such as GPUs, that are hosted in the cloud. Cloud systems are vulnerable to attackers that compromise the privacy of data and integrity of computations. Tackling such a challenge efficiently requires exploiting hardware security capabilities to reduce the cost of theoretical privacy algorithms. This talk will describe recent experiences in building privacy preserving machine learning systems. Dr. Annavaram will present DarKnight, a framework for large DNN training while protecting input privacy and computation integrity. Then he will focus on ML training challenges in the cloud: namely, stragglers and Byzantine nodes. The conclusion covers thoughts on ML privacy and security going forward.","March 11, 2022 | 12-1pm","COB 1, 205",,,
div-in-tech-2022,2022 Diversity in Tech Symposium: Advancing Climate Resilience,https://na.eventscloud.com/ereg/newreg.php?eventid=599958&,Register to attend,"Now in its sixth year, the annual Diversity in Tech Symposium (formerly Women in Tech) will highlight the experiences of experts working to advance innovation in clean energy, water conservation, food systems, disaster prediction, coastal science, sustainable manufacturing and many other areas within their organizations. Attendees are encouraged to join the career fair Thursday afternoon to meet company representatives and discover pathways into climate tech. This event will also feature the EDGE in Tech Initiative Athena Awards, recognizing those who have championed the advancement of women and people of color in technology.","March 10-11, 2022",,,,
wip-banner,CITRIS Workforce Innovation Program Info Session,https://berkeley.zoom.us/webinar/register/WN_3H4poHy1QsOc7eOiWeYdWQ,Register to Attend,"Interested in learning more about opportunities for a paid summer internship in an area of emerging IT innovation? Students of all majors at the four CITRIS campuses (Berkeley, Davis, Merced, and Santa Cruz) are invited to join this live webinar for information about the new program. We will answer your questions about the application process and program components.<br><br>Students who represent the rich diversity of the University of California, including women, people from underrepresented backgrounds, Pell Grant recipients, undocumented students, and first-generation students, are encouraged to apply.","March 4, 2022 | 12pm",,,,
luca-agbag-2022,CITRIS Research on Ag-Food-Tech: Hybrid AGBag with DR. LUCA Brillante,https://ucmerced.zoom.us/meeting/register/tZcpduCrpz0iEtESpAEMBvwPGZE3FCX8LnTj,Register to attend via zoom,"Dr. Luca Brillante's work aims to develop new sensors and approaches to monitor and increase vineyard efficiency and sustainability.<br><br><b>Join Dr. Luca Brillante on Friday, February 25nd at 12pm in SE2 224 or via zoom with the button below.</b>",25-Feb-22,,,,
cress-leapfrog,CITRIS Aviation Prize: Project LEAP-FROG Takes Flight,https://citris-uc.org/event/citris-research-exchange-citris-aviation/,Learn More and Register to Attend,"In this talk, the winners of CITRIS’s first <a href=https://citris.ucmerced.edu/news/citris-announces-winners-of-first-ever-student-aviation-prize target=_blank>Aviation Prize</a> will describe their winning proposal for a “long endurance edge-AI platform for research opportunities and data gathering” platform, or (LEAP-FROG) to demonstrate a small unmanned aircraft system (sUAS) Federal Aviation Administration (FAA) part 107 compliant fully autonomous flight of 115 miles, within a 5-mile circumference and including a 45-min battery reserve at UC Merced’s Vernal Pools.",23-Feb-22,,,,
weathers,CITRIS RESEARCH ON AG-FOOD TECH: HYBRID AGBAG,https://bit.ly/zoomWeathers,Register to Attend,"As technology expands the capacity of growers to gather data about their management we must ask questions about what are the right kinds of data, who owns the data, and how is it most helpful for the user. Join Robbie Weathers as he explores how this data must be balanced to serve the end goals of the grower and sustainability. <br><b>About the Speaker:</b> Robbie Weathers is a Product Manager at Granular, a Farm Management Software company that leverages fine-scale data to improve decision-making among growers.","November 18, 2021 | 12:00-1:00 PM",,"<a href=https://add.eventable.com/events/61413dde26559321b19db450/616602f50fddb90d3b4af8b8/ data-event=616602f50fddb90d3b4af8b8 class=eventable-link target=_blank data-key=61413dde26559321b19db450 data-style=3>Add to Calendar</a><script>!function(d,s,id){var js,fjs=d.getElementsByTagName(s)[0];if(!d.getElementById(id)){js=d.createElement(s);js.id=id;js.src='https://plugins.eventable.com/eventable.js';fjs.parentNode.insertBefore(js, fjs);}}(document, 'script', 'eventable-script');</script>",,
,CITRIS Research Exchange – Laurel Larsen on Climate Change,https://bit.ly/researchexchange2021,Register for Live Event,"<img id='img-wrapped' class='photo' src='../images/people/laurel-larson.jpg' alt=''><b>SPEAKER</b>: Laurel Larsen, Associate Professor and Delta Lead Scientist, UC Berkeley and Delta Stewardship Council<br><br><b>Abstract</b>:  Climate models project that changes in patterns of temperature and precipitation delivery will be ubiquitous, but how those changes cascade through watersheds is less certain. Indeed, the widespread disconnect between changes in extreme precipitation and extreme streamflow contrasts with model projections and underlies what has been referred to as a “grand challenge” of hydrology. Using CHOSEN (Comprehensive Hydrologic Observatory Sensor Network), we conducted a data-driven analysis of multidimensional hydrologic and climatic extremes. We found that drought and warming likely explain many of the observed changes in streamflow extreme but that wetter extremes arise from more complex phenomena. The talk concludes with a summary of some of the remaining “grand challenges” for understanding drought’s cascading effects on California’s ecosystems.<br><br><b>Come join us in SSM 150 from 11:30 - 1:00pm for the in person event. Lunch will be provided!</b><br><br> To zoom into the research exchange, visit: <a href=https://citris-uc.org/event/citris-research-exchange-laurel-larsen/ target=_blank>https://citris-uc.org/event/citris-research-exchange-laurel-larsen/</a>","November 3, 2021 | 11:30 - 1:00pm",S,Zoom,,
foundry2021,CITRIS Foundry Startup Showcase,https://www.eventbrite.com/e/citris-foundry-startup-showcase-tickets-170340976446?aff=odeimcmailchimp&mc_cid=aaa49aac01&mc_eid=9540515cc2,Learn more,"Join us for a virtual celebration of select startup teams from S21 Cohort, hear from alumni and community entrepreneurs, and network with our innovators, entrepreneurs, mentors, and supporters!",21-Oct-21,,,,
,CITRIS Research Exchange – Ahmed Sabbir Arif on Human Computer Interaction,https://bit.ly/researchexchange2021,Register for Live Event,"<img id='img-wrapped' class='photo' src='../images/people/ahmed_arif.jpg' alt=''><b>SPEAKER</b>: Dr. Ahmed Sabbir Arif, Assistant Professor Computer Science and Engineering, UC Merced<br><br><b>Abstract</b>: Silent speech that converts lip movements into text can mitigate many challenges of speech and traditional input methods. Yet, existing silent speech recognition models are error-prone or use impractical extremal devices or implants. In this talk, I will present the findings of three projects involving silent speech input. First, a social study established silent speech as an acceptable and desired mode of interaction. Second, two empirical studies revealed that users are more tolerant of errors in silent speech and tend to speak slowly when interacting with it. Third, a new end-to-end deep neural network that can automatically segment lip sequence videos and classify them into text. In an evaluation, the model reduced the word error rate by 57% compared to the state-of-the-arts without compromising the overall computation time.<br><br><b>Come join us in SSM 150 from 12:00 - 1:00pm for the in person event. Lunch will be provided!</b><br><br>To zoom into the research exchange, visit: <a href=https://citris-uc.org/event/citris-research-exchange-ahmed-sabbir-arif/ target=_blank>https://citris-uc.org/event/citris-research-exchange-ahmed-sabbir-arif/</a>","October 20, 2021 | 12:00 - 1:00pm",S,Zoom,,
AgBagLACA,CITRIS RESEARCH ON AG-FOOD TECH: HYBRID AGBAG,https://ucmerced.zoom.us/meeting/register/tZYpdO2ppjwqGtZUL0qtuOp5N57vSW5RF_mS,Register to Attend,"Automation, digitization, and platformization continue to impact and reshape CA agriculture presenting new opportunities and quandaries for the industry and its workers. In our presentation we review our research related to these issues. ",12-Oct-21,,,,
,Agriculture/Water/Energy (AWE) Education Series: Future Impacts of Technology and Water Resources on Farming.,https://cccconfer.zoom.us/webinar/register/WN_VkCBDPNMQoGKaq8_a3C43g,Register to Attend,"<img id='img-wrapped' class='photo' src='../images/people/josh-viers.jpg' alt=''><b>SPEAKER</b>: Dr. Joshua Viers is a Professor of Water Resources Management in the School of Engineering at UC Merced, where he also serves as the Associate Dean for Research and Director of the Center for Information Technology Research in the Interest of Society (CITRIS). <br><br><b>Description</b>: In the second webinar of the Ag-Water-Energy Education Series we will explore the current challenges of water constraints and an evolving energy economy on the future of agriculture and how adaptive technologies can be employed to sustain farming in the Central Valley.","Tuesday, October 5th | 3:00 - 4:30 pm",S,Zoom,,
